Key,en,es,ar,fr
Dashboard,Dashboard,Panel,لوحة القيادة,Tableau de bord
Language,Language,Idioma,لغة,Langue
Information,Information,Información,معلومة,Information
Language Information,Language Information,Información de idioma,معلومات اللغة,Informations linguistiques
Language Manager,Language Manager,Administrador de idiomas,مدير اللغة,Gestionnaire de langues
Language created successfully!,Language created successfully!,¡Idioma creado exitosamente!,تم إنشاء اللغة بنجاح!,Langue créée avec succès !
Basic settings fetch successfully!,Basic settings fetch successfully!,¡La configuración básica se obtuvo correctamente!,تم جلب الإعدادات الأساسية بنجاح!,Les paramètres de base ont été récupérés avec succès !
Access denied! Unauthenticated,Access denied! Unauthenticated,¡Acceso denegado! No autenticado,تم الرفض! غير مصادق عليه,Accès refusé! Non authentifié
Verification code sended successfully to your mail. Please check your mail inbox/spam to verify,Verification code sended successfully to your mail. Please check your mail inbox/spam to verify,Código de verificación enviado exitosamente a tu correo. Por favor revise su bandeja de entrada/spam para verificar,تم إرسال رمز التحقق بنجاح إلى بريدك. يرجى التحقق من صندوق البريد الوارد/البريد العشوائي للتحقق,Code de vérification envoyé avec succès à votre courrier. Veuillez vérifier votre boîte de réception/spam pour vérifier
Verification code resend successfully!,Verification code resend successfully!,¡El código de verificación se reenvía exitosamente!,تم إعادة إرسال رمز التحقق بنجاح!,Le code de vérification a été renvoyé avec succès !
Invalid OTP. Please try again,Invalid OTP. Please try again,OTP no válida. Por favor inténtalo de nuevo,كلمة المرور لمرة واحدة غير صالحة. يرجى المحاولة مرة أخرى,OTP invalide. Veuillez réessayer
Account successfully verified,Account successfully verified,Cuenta verificada exitosamente,تم التحقق من الحساب بنجاح,Compte vérifié avec succès
You are already KYC Verified User,You are already KYC Verified User,Ya eres usuario verificado de KYC,أنت بالفعل مستخدم تم التحقق منه KYC,Vous êtes déjà un utilisateur vérifié KYC
Your KYC information is submitted. Please wait for admin confirmation,Your KYC information is submitted. Please wait for admin confirmation,Se envía su información KYC. Espere la confirmación del administrador.,تم إرسال معلومات KYC الخاصة بك. الرجاء الانتظار لتأكيد المشرف,Vos informations KYC sont soumises. Veuillez attendre la confirmation de l'administrateur
User KYC section is under maintenance,User KYC section is under maintenance,La sección KYC del usuario está en mantenimiento,قسم KYC للمستخدم قيد الصيانة,La section KYC de l'utilisateur est en cours de maintenance
User KYC input fields fetch successfully!,User KYC input fields fetch successfully!,¡Los campos de entrada KYC del usuario se recuperaron correctamente!,تم جلب حقول إدخال KYC للمستخدم بنجاح!,Les champs de saisie KYC de l'utilisateur sont récupérés avec succès !
KYC information successfully submitted,KYC information successfully submitted,La información KYC se envió correctamente,تم إرسال معلومات KYC بنجاح,Informations KYC soumises avec succès
Your account secure with google 2FA,Your account secure with google 2FA,Su cuenta segura con Google 2FA,حسابك آمن مع جوجل 2FA,Votre compte sécurisé avec Google 2FA
To enable two factor authentication (powered by google) please visit your web dashboard Click here:,To enable two factor authentication (powered by google) please visit your web dashboard Click here:,"Para habilitar la autenticación de dos factores (con tecnología de Google), visite su panel web. Haga clic aquí:",لتمكين المصادقة الثنائية (المدعومة من Google)، يرجى زيارة لوحة تحكم الويب الخاصة بك انقر هنا:,"Pour activer l'authentification à deux facteurs (optimisée par Google), veuillez visiter votre tableau de bord Web. Cliquez ici :"
Your secret key not stored properly. Please contact with system administrator,Your secret key not stored properly. Please contact with system administrator,Su clave secreta no se almacenó correctamente. Por favor contacte con el administrador del sistema,لم يتم تخزين مفتاحك السري بشكل صحيح. يرجى الاتصال بمسؤول النظام,Votre clé secrète n'est pas stockée correctement. Veuillez contacter l'administrateur système
Google 2FA successfully verified!,Google 2FA successfully verified!,¡Google 2FA verificado con éxito!,تم التحقق من المصادقة الثنائية على Google بنجاح!,Google 2FA vérifié avec succès !
Invalid authentication code,Invalid authentication code,Código de autenticación no válido,رمز المصادقة غير صالح,Code d'authentification invalide
Failed to login. Please try again,Failed to login. Please try again,No se pudo iniciar sesión. Por favor inténtalo de nuevo,فشل تسجيل الدخول. يرجى المحاولة مرة أخرى,Échec de la connexion. Veuillez réessayer
User doesn't exists,User doesn't exists,El usuario no existe,المستخدم غير موجود,L'utilisateur n'existe pas
Your account is temporary banded. Please contact with system admin,Your account is temporary banded. Please contact with system admin,Su cuenta está bloqueada temporalmente. Por favor contacte con el administrador del sistema,حسابك مؤقت. يرجى الاتصال بمسؤول النظام,Votre compte est temporairement bloqué. Veuillez contacter l'administrateur système
Verification code sended to your email address,Verification code sended to your email address,Código de verificación enviado a su dirección de correo electrónico,تم إرسال رمز التحقق إلى عنوان بريدك الإلكتروني,Code de vérification envoyé à votre adresse e-mail
Session expired. Please try again,Session expired. Please try again,La sesión expiró. Por favor inténtalo de nuevo,انتهت صلاحية الجلسة. يرجى المحاولة مرة أخرى,Session expirée. Veuillez réessayer
Verification Otp is Invalid,Verification Otp is Invalid,La verificación OTP no es válida,التحقق من Otp غير صالح,La vérification Otp est invalide
OTP successfully verified!,OTP successfully verified!,¡OTP verificada con éxito!,تم التحقق من كلمة مرور OTP بنجاح!,OTP vérifié avec succès !
Request token is invalid,Request token is invalid,El token de solicitud no es válido,رمز الطلب غير صالح,Le jeton de demande n'est pas valide
OTP resend success,OTP resend success,Reenvío OTP exitoso,تم إعادة إرسال OTP بنجاح,OTP renvoie avec succès
Password reset success,Password reset success,Restablecimiento de contraseña exitoso,نجاح إعادة تعيين كلمة المرور,Réinitialisation réussie du mot de passe
Credentials didn't match,Credentials didn't match,Las credenciales no coincidieron,بيانات الاعتماد غير متطابقة,Les informations d'identification ne correspondent pas
Login Failed! Failed to refresh wallet! Please try again,Login Failed! Failed to refresh wallet! Please try again,¡Error de inicio de sesion! ¡No se pudo actualizar la billetera! Por favor inténtalo de nuevo,فشل تسجيل الدخول! فشل تحديث المحفظة! يرجى المحاولة مرة أخرى,La connexion a échoué! Échec de l'actualisation du portefeuille ! Veuillez réessayer
User successfully logged in,User successfully logged in,El usuario inició sesión exitosamente,تم تسجيل دخول المستخدم بنجاح,Utilisateur connecté avec succès
Registration failed! Please try again,Registration failed! Please try again,¡El registro falló! Por favor inténtalo de nuevo,فشل التسجيل! يرجى المحاولة مرة أخرى,L'inscription a échoué ! Veuillez réessayer
Failed to fetch user information. Please try again,Failed to fetch user information. Please try again,No se pudo recuperar la información del usuario. Por favor inténtalo de nuevo,فشل في جلب معلومات المستخدم. يرجى المحاولة مرة أخرى,Échec de la récupération des informations utilisateur. Veuillez réessayer
Failed to generate user token! Please try again,Failed to generate user token! Please try again,¡No se pudo generar el token de usuario! Por favor inténtalo de nuevo,فشل في إنشاء الرمز المميز للمستخدم! يرجى المحاولة مرة أخرى,Échec de la génération du jeton utilisateur ! Veuillez réessayer
Registration Failed! Failed to create wallet! Please try again,Registration Failed! Failed to create wallet! Please try again,¡El registro falló! ¡No se pudo crear la billetera! Por favor inténtalo de nuevo,فشل التسجيل! فشل في إنشاء المحفظة! يرجى المحاولة مرة أخرى,L'inscription a échoué ! Échec de la création du portefeuille ! Veuillez réessayer
User successfully registered,User successfully registered,Usuario registrado exitosamente,تم تسجيل المستخدم بنجاح,Utilisateur enregistré avec succès
Failed to fetch data. Please try again,Failed to fetch data. Please try again,No se pudieron recuperar los datos. Por favor inténtalo de nuevo,فشل في جلب البيانات. يرجى المحاولة مرة أخرى,Échec de la récupération des données. Veuillez réessayer
Payment gateway fetch successfully!,Payment gateway fetch successfully!,¡La pasarela de pago se obtuvo correctamente!,تم جلب بوابة الدفع بنجاح!,La passerelle de paiement a été récupérée avec succès !
Can't submit manual gateway in automatic link,Can't submit manual gateway in automatic link,No se puede enviar la puerta de enlace manual en el enlace automático,لا يمكن إرسال البوابة اليدوية في الرابط التلقائي,Impossible de soumettre une passerelle manuelle dans un lien automatique
Transaction failed. Record didn't saved properly. Please try again,Transaction failed. Record didn't saved properly. Please try again,La transacción falló. El registro no se guardó correctamente. Por favor inténtalo de nuevo,فشلت المعاملة. لم يتم حفظ السجل بشكل صحيح. يرجى المحاولة مرة أخرى,La transaction a échoué. L'enregistrement n'a pas été enregistré correctement. Veuillez réessayer
Payment process cancel successfully!,Payment process cancel successfully!,¡El proceso de pago se cancela exitosamente!,تم إلغاء عملية الدفع بنجاح!,Le processus de paiement a été annulé avec succès !
Can't get fields. Requested gateway is automatic,Can't get fields. Requested gateway is automatic,No puedo obtener campos. La puerta de enlace solicitada es automática.,لا يمكن الحصول على الحقول. البوابة المطلوبة تلقائية,Impossible d'obtenir des champs. La passerelle demandée est automatique
This payment gateway is under constructions. Please try with another payment gateway,This payment gateway is under constructions. Please try with another payment gateway,Esta pasarela de pago está en construcción. Por favor intenta con otra pasarela de pago,بوابة الدفع هذه قيد الإنشاء. يرجى المحاولة باستخدام بوابة دفع أخرى,Cette passerelle de paiement est en construction. Veuillez essayer avec une autre passerelle de paiement
Payment gateway input fields fetch successfully!,Payment gateway input fields fetch successfully!,¡Los campos de entrada de la pasarela de pago se recuperaron correctamente!,تم جلب حقول إدخال بوابة الدفع بنجاح!,Les champs de saisie de la passerelle de paiement ont été récupérés avec succès !
Can't submit automatic gateway in manual link,Can't submit automatic gateway in manual link,No se puede enviar la puerta de enlace automática en el enlace manual,لا يمكن إرسال البوابة التلقائية في الرابط اليدوي,Impossible de soumettre une passerelle automatique dans un lien manuel
Selected gateway is invalid,Selected gateway is invalid,La puerta de enlace seleccionada no es válida,البوابة المحددة غير صالحة,La passerelle sélectionnée n'est pas valide
Transaction Failed. Failed to save information. Please try again,Transaction Failed. Failed to save information. Please try again,La transacción falló. No se pudo guardar la información. Por favor inténtalo de nuevo,فشلت الصفقة. فشل في حفظ المعلومات. يرجى المحاولة مرة أخرى,Échec de la transaction. Échec de l'enregistrement des informations. Veuillez réessayer
Your wallet is invalid!,Your wallet is invalid!,¡Tu billetera no es válida!,محفظتك غير صالحة!,Votre portefeuille n'est pas valide !
Transaction Success. Please wait for admin confirmation,Transaction Success. Please wait for admin confirmation,Éxito de la transacción. Espere la confirmación del administrador.,نجاح الصفقة. الرجاء الانتظار لتأكيد المشرف,Succès des transactions. Veuillez attendre la confirmation de l'administrateur
Request response fetch successfully!,Request response fetch successfully!,¡La solicitud de respuesta se obtuvo correctamente!,تم جلب الاستجابة للطلب بنجاح!,La réponse à la demande a été récupérée avec succès !
Payment gateway response successful,Payment gateway response successful,Respuesta exitosa de la pasarela de pago,استجابة بوابة الدفع ناجحة,Réponse réussie de la passerelle de paiement
User dashboard data fetch successfully!,User dashboard data fetch successfully!,¡Los datos del panel de usuario se recuperaron correctamente!,تم جلب بيانات لوحة تحكم المستخدم بنجاح!,Les données du tableau de bord utilisateur ont été récupérées avec succès !
Investment plan list fetch successfully!,Investment plan list fetch successfully!,¡La lista de planes de inversión se obtuvo con éxito!,تم جلب قائمة خطة الاستثمار بنجاح!,La liste des plans d'investissement a été récupérée avec succès !
Oops! This plan is no longer available,Oops! This plan is no longer available,¡Ups! Este plan ya no está disponible,أُووبس! هذه الخطة لم تعد متوفرة,Oups ! Ce forfait n'est plus disponible
Oops! Wallet not found!,Oops! Wallet not found!,¡Ups! ¡Cartera no encontrada!,أُووبس! لم يتم العثور على المحفظة!,Oups ! Portefeuille introuvable !
Oops! Something went wrong! Please try again,Oops! Something went wrong! Please try again,¡Ups! ¡Algo salió mal! Por favor inténtalo de nuevo,أُووبس! حدث خطأ ما! يرجى المحاولة مرة أخرى,Oups ! Quelque chose s'est mal passé ! Veuillez réessayer
New Investment Plan Purchase Successfully!,New Investment Plan Purchase Successfully!,¡Compra del nuevo plan de inversión con éxito!,تم شراء خطة الاستثمار الجديدة بنجاح!,Achat d'un nouveau plan d'investissement avec succès !
Investment data fetch successfully!,Investment data fetch successfully!,¡Los datos de inversión se obtuvieron con éxito!,تم جلب بيانات الاستثمار بنجاح!,Les données d'investissement ont été récupérées avec succès !
Investment profit data fetch successfully!,Investment profit data fetch successfully!,¡Los datos de ganancias de inversión se obtuvieron con éxito!,تم جلب بيانات أرباح الاستثمار بنجاح!,Les données sur les bénéfices d'investissement sont récupérées avec succès !
User wallets fetch successfully!,User wallets fetch successfully!,¡Las carteras de los usuarios se recuperan correctamente!,تم جلب محافظ المستخدم بنجاح!,Les portefeuilles des utilisateurs sont récupérés avec succès !
Receiver doesn't exists or Receiver is temporary banned,Receiver doesn't exists or Receiver is temporary banned,El receptor no existe o el receptor está prohibido temporalmente,جهاز الاستقبال غير موجود أو جهاز الاستقبال محظور مؤقتًا,Le récepteur n'existe pas ou le récepteur est temporairement banni
Receiver wallet not available,Receiver wallet not available,Cartera receptora no disponible,محفظة المتلقي غير متوفرة,Portefeuille récepteur non disponible
Transaction failed! Something went wrong! Please try again,Transaction failed! Something went wrong! Please try again,¡La transacción falló! ¡Algo salió mal! Por favor inténtalo de nuevo,فشلت الصفقة! حدث خطأ ما! يرجى المحاولة مرة أخرى,La transaction a échoué ! Quelque chose s'est mal passé ! Veuillez réessayer
Profile info fetch successfully!,Profile info fetch successfully!,¡La información del perfil se obtuvo correctamente!,تم جلب معلومات الملف الشخصي بنجاح!,Les informations de profil ont été récupérées avec succès !
Phone number already exists,Phone number already exists,El número de teléfono ya existe,رقم الهاتف موجود بالفعل,Le numéro de téléphone existe déjà
Profile successfully updated!,Profile successfully updated!,¡Perfil actualizado exitosamente!,تم تحديث الملف الشخصي بنجاح!,Profil mis à jour avec succès !
Current password didn't match,Current password didn't match,La contraseña actual no coincide,كلمة المرور الحالية غير متطابقة,Le mot de passe actuel ne correspond pas
Password successfully updated!,Password successfully updated!,¡Contraseña actualizada exitosamente!,تم تحديث كلمة المرور بنجاح!,Mot de passe mis à jour avec succès !
Logout success!,Logout success!,¡Cerrar sesión exitosamente!,نجاح تسجيل الخروج!,Déconnexion réussie !
Splash screen data fetch successfully!,Splash screen data fetch successfully!,¡Los datos de la pantalla de bienvenida se recuperaron correctamente!,تم جلب بيانات شاشة البداية بنجاح!,Les données de l'écran de démarrage ont été récupérées avec succès !
Onboard screen data fetch successfully!,Onboard screen data fetch successfully!,¡Los datos de la pantalla integrada se recuperaron correctamente!,تم جلب بيانات الشاشة الموجودة على اللوحة بنجاح!,Récupération réussie des données de l'écran intégré !
Transactions fetch successfully!,Transactions fetch successfully!,¡Las transacciones se recuperan correctamente!,جلب المعاملات بنجاح!,Les transactions sont récupérées avec succès !
Request data fetch successfully!,Request data fetch successfully!,¡Solicite la recuperación de datos exitosamente!,طلب جلب البيانات بنجاح!,Demander la récupération des données avec succès !
Payment gateway not found!,Payment gateway not found!,¡Pasarela de pago no encontrada!,بوابة الدفع غير موجودة!,Passerelle de paiement introuvable !
Payment gateway is under maintenance. Please try with another gateway,Payment gateway is under maintenance. Please try with another gateway,La pasarela de pago se encuentra en mantenimiento. Por favor intenta con otra puerta de enlace,بوابة الدفع تحت الصيانة. يرجى المحاولة مع بوابة أخرى,La passerelle de paiement est en maintenance. Veuillez essayer avec une autre passerelle
Payment gateway input field fetch successfully!,Payment gateway input field fetch successfully!,¡El campo de entrada de la pasarela de pago se obtuvo correctamente!,تم جلب حقل إدخال بوابة الدفع بنجاح!,Le champ de saisie de la passerelle de paiement a été récupéré avec succès !
Service not available!,Service not available!,¡Servicio no disponible!,الخدمة غير متوفرة!,Service non disponible !
Gateway isn't available for this transaction,Gateway isn't available for this transaction,La puerta de enlace no está disponible para esta transacción,البوابة غير متاحة لهذه المعاملة,La passerelle n'est pas disponible pour cette transaction
Your wallet balance is insufficient,Your wallet balance is insufficient,El saldo de tu billetera es insuficiente,رصيد محفظتك غير كافي,Le solde de votre portefeuille est insuffisant
Oops! Wallet type not defined,Oops! Wallet type not defined,¡Ups! Tipo de billetera no definido,أُووبس! لم يتم تحديد نوع المحفظة,Oups ! Type de portefeuille non défini
Language data fetch successfully!,Language data fetch successfully!,¡Los datos de idioma se obtuvieron correctamente!,تم جلب بيانات اللغة بنجاح!,Les données de langue ont été récupérées avec succès !
WOW,WOW,GUAU,رائع,OUAH
App Name,App Name,Nombre de la aplicación,اسم التطبيق,Nom de l'application
Please Fill Out The Field,Please Fill Out The Field,Por favor complete el campo,يرجى ملء الحقل,Veuillez remplir le champ
PLEASE CONNECT TO THE INTERNET,PLEASE CONNECT TO THE INTERNET,POR FAVOR CONÉCTATE A INTERNET,يرجى الاتصال بالإنترنت,VEUILLEZ VOUS CONNECTER À INTERNET
Sign In,Sign In,Iniciar sesión,تسجيل الدخول,Se connecter
Sign Up,Sign Up,Inscribirse,اشتراك,S'inscrire
Password,Password,Contraseña,كلمة المرور,Mot de passe
Old Password,Old Password,Contraseña anterior,كلمة المرور القديمة,Ancien mot de passe
Enter Password,Enter Password,Ingrese la contraseña,أدخل كلمة المرور,Entrez le mot de passe
Forget Password,Forget Password,Olvidar Contraseña,نسيت كلمة المرور,Mot de passe oublié
Get Started,Get Started,Empezar,ابدأ,Commencer
Email Address,Email Address,Dirección de correo electrónico,عنوان البريد الإلكتروني,Adresse email
Enter Email Address,Enter Email Address,Ingrese la dirección de correo electrónico,أدخل عنوان البريد الإلكتروني,Entrez l'adresse e-mail
Enter The OTP Code Sent to,Enter The OTP Code Sent to,Ingrese el código OTP enviado a,أدخل رمز OTP المرسل إليه,Entrez le code OTP envoyé à
Verified Code,Verified Code,Código verificado,رمز التحقق,Code vérifié
Submit,Submit,Entregar,يُقدِّم,Soumettre
OTP Verification,OTP Verification,Verificación OTP,التحقق من OTP,Vérification OTP
Two Fa OTP Verification,Two Fa OTP Verification,Verificación de dos Fa OTP,التحقق من اثنين من Fa OTP,Vérification OTP de deux Fa
Email Verification,Email Verification,Verificación de correo electrónico,التحقق من البريد الإلكتروني,Vérification par e-mail
New Password,New Password,Nueva contraseña,كلمة المرور الجديدة,Nouveau mot de passe
Confirm Password,Confirm Password,confirmar Contraseña,تأكيد كلمة المرور,Confirmez le mot de passe
Enter,Enter,Ingresar,يدخل,Entrer
Reset Password,Reset Password,Restablecer contraseña,إعادة تعيين كلمة المرور,Réinitialiser le mot de passe
Congratulations!!,Congratulations!!,¡¡Felicidades!!,مبروك!!,Félicitations!!
Create Account,Create Account,Crear una cuenta,إنشاء حساب,Créer un compte
First Name,First Name,Nombre de pila,الاسم الأول,Prénom
Last Name,Last Name,Apellido,اسم العائلة,Nom de famille
Okay,Okay,Bueno,تمام,D'accord
TRANSFER,TRANSFER,TRANSFERIR,تحويل,TRANSFERT
Exchange,Exchange,Intercambio,تبادل,Échange
Request,Request,Pedido,طلب,Demande
Recent Transaction,Recent Transaction,Transacción reciente,المعاملة الأخيرة,Transaction récente
My Invoice,My Invoice,mi factura,فاتورتي,Ma facture
My Voucher,My Voucher,Mi vale,قسيمتي,Mon bon
Transaction Log,Transaction Log,Registro de transacciones,سجل المعاملات,Journal des transactions
2FA Security,2FA Security,Seguridad 2FA,2FA الأمن,Sécurité 2FA
Change Password,Change Password,Cambiar la contraseña,تغيير كلمة المرور,Changer le mot de passe
Help Center,Help Center,Centro de ayuda,مركز المساعدة,Centre d'aide
Privacy & Policy,Privacy & Policy,Política de privacidad,سياسة الخصوصية,Politique de confidentialité
About Us,About Us,Sobre nosotros,معلومات عنا,À propos de nous
Sign Out,Sign Out,Desconectar,تسجيل الخروج,Se déconnecter
Amount,Amount,Cantidad,كمية,Montant
Preview Screen,Preview Screen,Pantalla de vista previa,شاشة المعاينة,Écran d'aperçu
Preview,Preview,Avance,معاينة,Aperçu
Exchange Rate,Exchange Rate,Tipo de cambio,سعر الصرف,Taux de change
Total Fees & Charges,Total Fees & Charges,Tarifas y cargos totales,إجمالي الرسوم والمصاريف,Total des frais et charges
Will Get,Will Get,obtendrá,سوف تحصل,obtiendra
Total Payable Ammount,Total Payable Ammount,Monto total a pagar,إجمالي المبلغ المستحق,Montant total à payer
Confirm,Confirm,Confirmar,يتأكد,Confirmer
Money Exchange,Money Exchange,Cambio de dinero,صرف العملات,Échange d'argent
From,From,De,من,Depuis
To,To,A,ل,À
Request Money,Request Money,Solicitar dinero,طلب المال,Demander de l'argent
Remarks,Remarks,Observaciones,ملاحظات,Remarques
